{
  "version": "2.0.0",
  "metadata": {
    "architecture": "hailo15h",
    "content_hash": "56fefa6501cec1fb89236ffc874e59e10497d2e9f572605a7d5c9168d039dcc8",
    "description": "",
    "generation_timestamp": "2026-03-08T10:21:48.480902+00:00"
  },
  "backup_folder_path": "/etc/imaging/cfg/backups/gst_example",
  "default_profile": "Daylight",
  "profiles": [
    {
      "config_file": "/etc/imaging/cfg/hailo15h/imx678/kit/4k/profiles/daylight/gst_example_daylight/gst_example_daylight_profile.json",
      "name": "Daylight"
    },
    {
      "config_file": "/etc/imaging/cfg/hailo15h/imx678/kit/4k/profiles/HDR/gst_example_HDR/gst_example_HDR_profile.json",
      "name": "High_Dynamic_Range"
    },
    {
      "config_file": "/etc/imaging/cfg/hailo15h/imx678/kit/4k/profiles/lowlight/lowlight_r0225c8/lowlight_r0225c8_profile.json",
      "name": "Lowlight"
    },
    {
      "config_file": "/etc/imaging/cfg/hailo15h/imx678/kit/4k/profiles/lowlight/lowlight_bayer_r0225c8/lowlight_bayer_r0225c8_profile.json",
      "name": "Lowlight_Bayer"
    },
    {
      "config_file": "/etc/imaging/cfg/hailo15h/imx678/kit/4k/profiles/IR/gst_example_IR/gst_example_IR_profile.json",
      "name": "Infrared"
    }
  ]
}
