{
  "version": "2.0.0",
  "metadata": {
    "architecture": "hailo15h",
    "content_hash": "0085a3ab8f46e6bde3e0da5a8c374d7afec6c89b803b3bf32995604c5e64576a",
    "description": "",
    "generation_timestamp": "2026-01-04T16:18:48.463338+00:00"
  },
  "backup_folder_path": "/etc/imaging/cfg/backups/ai_example_dual_sensor_sensor_0",
  "default_profile": "Daylight",
  "profiles": [
    {
      "config_file": "/etc/imaging/cfg/hailo15h/imx678/theia_sl410m/4k/profiles/daylight/ai_example_dual_sensor_sensor_0_daylight/ai_example_dual_sensor_sensor_0_daylight_profile.json",
      "name": "Daylight"
    }
  ]
}
