{
  "version": "2.0.0",
  "metadata": {
    "architecture": "hailo15l",
    "content_hash": "3984dcdef165953481a96ccdf854a2ee6087fb36effbae5ba3f654524723b83e",
    "description": "",
    "generation_timestamp": "2026-03-10T17:39:10.396311+00:00"
  },
  "backup_folder_path": "/etc/imaging/cfg/backups/ai_example",
  "default_profile": "Daylight",
  "profiles": [
    {
      "config_file": "/etc/imaging/cfg/hailo15l/imx662/theia_sl410m/fhd/profiles/daylight/ai_example_daylight/ai_example_daylight_profile.json",
      "name": "Daylight"
    },
    {
      "config_file": "/etc/imaging/cfg/hailo15l/imx662/theia_sl410m/fhd/profiles/HDR/ai_example_HDR/ai_example_HDR_profile.json",
      "name": "High_Dynamic_Range"
    }
  ]
}
